{
  "schemaVersion": 1,
  "id": "phone-apps",
  "name": "Приложения на телефоне",
  "description": "Популярные соцсети, сервисы, программы и мобильные игры",
  "groups": [
    {
      "id": "social-networks",
      "name": "Соцсети и короткие видео",
      "items": [
        "TikTok",
        "Instagram",
        "ВКонтакте",
        "Одноклассники",
        "Snapchat",
        "Pinterest",
        "Likee",
        "Дзен",
        "Threads",
        "X (Twitter)",
        "Facebook",
        "Reddit"
      ]
    },
    {
      "id": "messengers-and-calls",
      "name": "Мессенджеры и видеозвонки",
      "items": [
        "Telegram",
        "MAX",
        "WhatsApp",
        "VK Мессенджер",
        "Discord",
        "Viber",
        "Zoom",
        "Google Meet",
        "FaceTime",
        "Microsoft Teams"
      ]
    },
    {
      "id": "shopping-and-delivery",
      "name": "Покупки и доставка",
      "items": [
        "Wildberries",
        "Ozon",
        "Авито",
        "Яндекс Маркет",
        "AliExpress",
        "Lamoda",
        "Мегамаркет",
        "ВкусВилл",
        "Яндекс Лавка",
        "Самокат",
        "Купер",
        "Магнит",
        "Пятёрочка",
        "Детский мир"
      ]
    },
    {
      "id": "video-and-music",
      "name": "Видео, кино и музыка",
      "items": [
        "YouTube",
        "VK Видео",
        "RuTube",
        "Кинопоиск",
        "Иви",
        "Okko",
        "Wink",
        "KION",
        "PREMIER",
        "START",
        "Яндекс Музыка",
        "VK Музыка",
        "Spotify",
        "Apple Music",
        "Shazam"
      ]
    },
    {
      "id": "system-and-stores",
      "name": "Системные приложения и магазины",
      "items": [
        "Погода",
        "Календарь",
        "Заметки",
        "Камера",
        "Фото",
        "Почта",
        "App Store",
        "Карты",
        "Настройки",
        "Калькулятор",
        "Контакты",
        "Часы",
        "Файлы",
        "VPN",
        "RuStore"
      ]
    },
    {
      "id": "transport-and-travel",
      "name": "Транспорт и путешествия",
      "items": [
        "Яндекс Go",
        "Яндекс Карты",
        "2ГИС",
        "Google Maps",
        "Ситимобил",
        "Яндекс Драйв",
        "Whoosh",
        "РЖД Пассажирам",
        "Авиасейлс",
        "Туту",
        "Аэрофлот",
        "S7 Airlines"
      ]
    },
    {
      "id": "finance-and-government",
      "name": "Банки, платежи и государство",
      "items": [
        "Госуслуги",
        "СберБанк Онлайн",
        "Т-Банк",
        "Альфа-Банк",
        "ВТБ Онлайн",
        "Газпромбанк",
        "МТС Банк",
        "Почта Банк",
        "Совкомбанк",
        "Россельхозбанк",
        "СБПэй",
        "Mir Pay",
        "Яндекс Пэй",
        "Госключ",
        "Налоги ФЛ"
      ]
    },
    {
      "id": "browsers-cloud-and-mobile",
      "name": "Браузеры, облака и мобильная связь",
      "items": [
        "МТС",
        "МегаФон",
        "билайн",
        "t2",
        "Yota",
        "Google",
        "Яндекс",
        "Google Chrome",
        "Safari",
        "Яндекс Браузер",
        "Firefox",
        "Яндекс Диск",
        "Google Диск",
        "Облако Mail",
        "Kaspersky"
      ]
    },
    {
      "id": "work-study-and-ai",
      "name": "Работа, учёба и нейросети",
      "items": [
        "Gmail",
        "Яндекс Почта",
        "Microsoft Word",
        "Microsoft Excel",
        "Microsoft PowerPoint",
        "Google Документы",
        "Google Таблицы",
        "Notion",
        "Duolingo",
        "ChatGPT",
        "DeepSeek",
        "GigaChat",
        "Яндекс Переводчик",
        "Google Переводчик",
        "Adobe Acrobat"
      ]
    },
    {
      "id": "mobile-games",
      "name": "Мобильные игры",
      "items": [
        "Brawl Stars",
        "Roblox",
        "Minecraft",
        "PUBG Mobile",
        "Standoff 2",
        "Tanks Blitz",
        "Genshin Impact",
        "Mobile Legends",
        "Call of Duty Mobile",
        "Clash Royale",
        "Subway Surfers",
        "Gardenscapes",
        "Toca Boca World"
      ]
    }
  ]
}
