{
  "schemaVersion": 1,
  "id": "countries",
  "name": "Страны",
  "description": "Самые известные страны мира",
  "groups": [
    {
      "id": "north-america",
      "name": "Северная Америка",
      "items": ["США", "Канада", "Мексика"]
    },
    {
      "id": "south-america",
      "name": "Южная Америка",
      "items": ["Бразилия", "Аргентина", "Чили", "Колумбия", "Перу"]
    },
    {
      "id": "western-europe",
      "name": "Западная Европа",
      "items": ["Франция", "Германия", "Великобритания", "Нидерланды", "Бельгия"]
    },
    {
      "id": "southern-europe",
      "name": "Южная Европа",
      "items": ["Испания", "Португалия", "Италия", "Греция", "Хорватия"]
    },
    {
      "id": "northern-europe",
      "name": "Северная Европа",
      "items": ["Норвегия", "Швеция", "Финляндия", "Дания", "Исландия"]
    },
    {
      "id": "central-europe",
      "name": "Центральная Европа",
      "items": ["Польша", "Чехия", "Австрия", "Венгрия", "Румыния"]
    },
    {
      "id": "eastern-europe-and-caucasus",
      "name": "Восточная Европа и Кавказ",
      "items": ["Россия", "Украина", "Беларусь", "Грузия", "Армения"]
    },
    {
      "id": "middle-east",
      "name": "Ближний Восток",
      "items": ["Турция", "Израиль", "ОАЭ", "Саудовская Аравия", "Иран"]
    },
    {
      "id": "east-asia",
      "name": "Восточная Азия",
      "items": ["Китай", "Япония", "Южная Корея", "Северная Корея"]
    },
    {
      "id": "south-and-southeast-asia",
      "name": "Южная и Юго-Восточная Азия",
      "items": ["Индия", "Таиланд", "Вьетнам", "Индонезия"]
    },
    {
      "id": "north-africa",
      "name": "Северная Африка",
      "items": ["Египет", "Марокко"]
    },
    {
      "id": "oceania",
      "name": "Океания",
      "items": ["Австралия", "Новая Зеландия"]
    }
  ]
}
