{
  "schemaVersion": 1,
  "id": "politicians",
  "name": "Политики",
  "description": "Известные мировые лидеры и политические деятели",
  "groups": [
    {
      "id": "russian-empire",
      "name": "Российская империя",
      "items": ["Пётр I", "Екатерина II", "Александр II", "Николай II"]
    },
    {
      "id": "soviet-leaders",
      "name": "Руководители СССР",
      "items": [
        "Владимир Ленин",
        "Иосиф Сталин",
        "Никита Хрущёв",
        "Леонид Брежнев",
        "Михаил Горбачёв"
      ]
    },
    {
      "id": "post-soviet-leaders",
      "name": "Постсоветские лидеры",
      "items": [
        "Борис Ельцин",
        "Владимир Путин",
        "Дмитрий Медведев",
        "Александр Лукашенко"
      ]
    },
    {
      "id": "ukrainian-politicians",
      "name": "Политики Украины",
      "items": [
        "Владимир Зеленский",
        "Пётр Порошенко",
        "Виктор Янукович"
      ]
    },
    {
      "id": "modern-us-presidents",
      "name": "Современные президенты США",
      "items": [
        "Дональд Трамп",
        "Джо Байден",
        "Барак Обама",
        "Билл Клинтон"
      ]
    },
    {
      "id": "historic-us-presidents",
      "name": "Исторические президенты США",
      "items": [
        "Джордж Вашингтон",
        "Авраам Линкольн",
        "Франклин Рузвельт",
        "Джон Кеннеди"
      ]
    },
    {
      "id": "british-politicians",
      "name": "Политики Великобритании",
      "items": ["Уинстон Черчилль", "Маргарет Тэтчер", "Борис Джонсон"]
    },
    {
      "id": "french-politicians",
      "name": "Политики Франции",
      "items": [
        "Наполеон Бонапарт",
        "Шарль де Голль",
        "Эмманюэль Макрон"
      ]
    },
    {
      "id": "german-politicians",
      "name": "Политики Германии",
      "items": ["Отто фон Бисмарк", "Адольф Гитлер", "Ангела Меркель"]
    },
    {
      "id": "italian-politicians",
      "name": "Политики Италии",
      "items": ["Бенито Муссолини"]
    },
    {
      "id": "middle-east-leaders",
      "name": "Лидеры Ближнего Востока и Северной Африки",
      "items": [
        "Реджеп Эрдоган",
        "Биньямин Нетаньяху",
        "Саддам Хусейн",
        "Муаммар Каддафи"
      ]
    },
    {
      "id": "east-asian-leaders",
      "name": "Лидеры Восточной Азии",
      "items": ["Мао Цзэдун", "Си Цзиньпин", "Ким Чен Ын"]
    },
    {
      "id": "revolution-and-liberation",
      "name": "Революционные и освободительные движения",
      "items": [
        "Фидель Кастро",
        "Че Гевара",
        "Махатма Ганди",
        "Нельсон Мандела"
      ]
    }
  ]
}
