{
  "schemaVersion": 1,
  "id": "disney",
  "name": "Disney",
  "description": "Принцессы и культовые персонажи Disney и Pixar",
  "groups": [
    {
      "id": "princesses-and-heroines",
      "name": "Принцессы и героини",
      "items": [
        "Золушка",
        "Рапунцель",
        "Белоснежка",
        "Ариэль",
        "Белль",
        "Жасмин",
        "Мулан",
        "Эльза",
        "Моана",
        "Анна",
        "Райя",
        "Аврора",
        "Покахонтас",
        "Тиана",
        "Мерида"
      ]
    },
    {
      "id": "mickey-ducks-and-friends",
      "name": "Микки, утки и друзья",
      "items": [
        "Микки Маус",
        "Минни Маус",
        "Дональд Дак",
        "Дейзи Дак",
        "Гуфи",
        "Скрудж Макдак",
        "Билли, Вилли и Дилли",
        "Чип и Дейл",
        "Чёрный Плащ"
      ]
    },
    {
      "id": "classic-fantasy",
      "name": "Классика и волшебные миры",
      "items": [
        "Питер Пэн",
        "Динь-Динь",
        "Капитан Крюк",
        "Алиса в стране чудес",
        "Чеширский Кот",
        "Безумный Шляпник",
        "Червонная Королева",
        "Пиноккио",
        "Дамбо",
        "Винни-Пух",
        "Пятачок",
        "Иа-Иа",
        "Бэмби"
      ]
    },
    {
      "id": "animal-classics",
      "name": "Классические истории о животных",
      "items": [
        "Маугли",
        "Балу",
        "Шер-Хан",
        "Леди и Бродяга",
        "Робин Гуд",
        "Вольт"
      ]
    },
    {
      "id": "the-lion-king",
      "name": "Король Лев",
      "items": [
        "Симба",
        "Тимон",
        "Пумба",
        "Шрам",
        "Муфаса",
        "Рафики"
      ]
    },
    {
      "id": "disney-renaissance",
      "name": "Миры Ренессанса Disney",
      "items": [
        "Аладдин",
        "Джинн",
        "Джафар",
        "Абу",
        "Чудовище",
        "Геркулес",
        "Аид",
        "Тарзан",
        "Квазимодо"
      ]
    },
    {
      "id": "modern-disney",
      "name": "Современные мультфильмы Disney",
      "items": [
        "Лило",
        "Стич",
        "Кузко",
        "Кронк",
        "Изма",
        "Ральф",
        "Ванилопа",
        "Джуди Хопс",
        "Ник Уайлд",
        "Бэймакс",
        "Хиро Хамада",
        "Мирабель",
        "Бруно",
        "Луиза"
      ]
    },
    {
      "id": "toy-story",
      "name": "История игрушек",
      "items": [
        "Вуди",
        "Базз Лайтер",
        "Джесси",
        "Бо Пип",
        "Рекс",
        "Спиралька",
        "Хэмм",
        "Мистер Картофельная Голова",
        "Лотсо",
        "Вилкинс",
        "Сид",
        "Энди",
        "Пришельцы",
        "Император Зург",
        "Булзай"
      ]
    },
    {
      "id": "pixar-adventures",
      "name": "Приключения Pixar",
      "items": [
        "Молния Маккуин",
        "Мэтр",
        "Салли Каррера",
        "Док Хадсон",
        "Реми",
        "Лингвини",
        "ВАЛЛ-И",
        "ЕВА",
        "Карл Фредриксен",
        "Рассел",
        "Кевин",
        "Радость",
        "Печаль",
        "Мигель",
        "Гектор"
      ]
    },
    {
      "id": "pixar-families-and-creatures",
      "name": "Семьи и существа Pixar",
      "items": [
        "Немо",
        "Дори",
        "Марлин",
        "Брюс",
        "Салли",
        "Майк Вазовски",
        "Бу",
        "Рэндалл",
        "Мистер Исключительный",
        "Эластика",
        "Фиалка",
        "Шастик",
        "Джек-Джек"
      ]
    }
  ]
}
