{
  "schemaVersion": 1,
  "id": "minecraft",
  "name": "Minecraft",
  "description": "Мобы, биомы, предметы и сооружения",
  "groups": [
    {
      "id": "hostile-overworld-mobs",
      "name": "Враждебные мобы обычного мира",
      "items": ["Зомби", "Скелет", "Крипер", "Паук", "Ведьма"]
    },
    {
      "id": "friendly-animals",
      "name": "Знакомые животные",
      "items": ["Грибная корова", "Свинья", "Овца", "Курица", "Лавамерка"]
    },
    {
      "id": "other-world-mobs",
      "name": "Мобы других миров",
      "items": ["Гаст", "Пиглин", "Ифрит", "Эндермен", "Шалкер"]
    },
    {
      "id": "classic-biomes",
      "name": "Классические биомы",
      "items": ["Пустыня", "Джунгли", "Болото", "Вишнёвая роща"]
    },
    {
      "id": "tools",
      "name": "Инструменты",
      "items": ["Алмазная кирка", "Деревянный топор", "Золотая лопата", "Удочка с искаженным грибом", "Ножницы"]
    },
    {
      "id": "combat-gear",
      "name": "Боевое снаряжение",
      "items": ["Незеритовый меч", "Лук", "Арбалет", "Щит", "Трезубец"]
    },
    {
      "id": "resources",
      "name": "Ценные ресурсы",
      "items": ["Алмаз", "Изумруд", "Железный слиток", "Редстоун"]
    },
    {
      "id": "mechanisms",
      "name": "Механизмы и транспорт",
      "items": ["Динамит", "Поршень", "Повторитель", "Вагонетка", "Сундук-ловушка"]
    },
    {
      "id": "structures",
      "name": "Известные сооружения",
      "items": ["Аванпост разбойников", "Заброшенная шахта", "Пустынный колодец", "Адский бастион", "Лесной особняк", "Хижина ведьмы"]
    }
  ]
}
