{
  "schemaVersion": 1,
  "id": "drinks",
  "name": "Напитки",
  "description": "Знакомые безалкогольные и алкогольные напитки",
  "groups": [
    {
      "id": "coffee",
      "name": "Кофе",
      "items": ["Эспрессо", "Американо", "Капучино", "Латте", "Раф", "Матча"]
    },
    {
      "id": "tea",
      "name": "Чай",
      "items": ["Чёрный чай", "Зелёный чай", "Фруктовый чай"]
    },
    {
      "id": "juice",
      "name": "Соки",
      "items": ["Апельсиновый сок", "Томатный сок", "Виноградный сок"]
    },
    {
      "id": "soft-drinks",
      "name": "Прохладительные напитки",
      "items": ["Кола", "Лимонад", "Квас", "Морс", "Минеральная вода"]
    },
    {
      "id": "dairy-drinks",
      "name": "Молочные напитки",
      "items": ["Молоко", "Кефир", "Ряженка", "Айран", "Питьевой йогурт"]
    },
    {
      "id": "beer-and-cider",
      "name": "Пиво и сидр",
      "items": ["Пиво",  "Безалкогольное пиво", "Сидр"]
    },
    {
      "id": "wine",
      "name": "Вино",
      "items": ["Красное вино", "Белое вино", "Шампанское", "Глинтвейн"]
    },
    {
      "id": "spirits",
      "name": "Крепкий алкоголь",
      "items": ["Водка", "Виски", "Коньяк", "Ром", "Текила", "Джин"]
    },
    {
      "id": "cocktails",
      "name": "Коктейли",
      "items": ["Мохито", "Джин-тоник", "Пина колада", "Кровавая Мэри", "Апероль шприц", "Секс на пляже"]
    },
    {
      "id": "sweet-drinks",
      "name": "Сладкие напитки",
      "items": ["Горячий шоколад", "Молочный коктейль", "Смузи"]
    }
  ]
}
