{
  "schemaVersion": 1,
  "id": "drugs",
  "name": "Наркотики",
  "description": "Известные психоактивные вещества и их классы",
  "groups": [
    {
      "id": "cannabis",
      "name": "Каннабис и его аналоги",
      "items": ["Марихуана", "Гашиш", "Спайс"]
    },
    {
      "id": "stimulants",
      "name": "Стимуляторы",
      "items": [
        "Кокаин",
        "Крэк",
        "Метамфетамин",
        "Мефедрон"
      ]
    },
    {
      "id": "opioids",
      "name": "Опиоиды",
      "items": ["Героин", "Опиум", "Морфин", "Кодеин", "Метадон", "Фентанил"]
    },
    {
      "id": "psychedelics",
      "name": "Психоделики",
      "items": [
        "ЛСД",
        "ДМТ"
      ]
    },
    {
      "id": "club-substances",
      "name": "Клубные вещества",
      "items": [
        "Экстази",
        "Кетамин",
        "Веселящий газ"
      ]
    },
    {
      "id": "sedatives",
      "name": "Успокоительные и снотворные",
      "items": [
        "Феназепам",
        "Ксанакс",
        "Снотворное",
        "Транквилизаторы"
      ]
    },
    {
      "id": "misused-medicines",
      "name": "Известные аптечные препараты",
      "items": [
        "Клофелин",
        "Корвалол"
      ]
    },
    {
      "id": "inhalants",
      "name": "Ингалянты",
      "items": [
        "Клей",
        "Бензин",
        "Растворитель",
        "Газ для зажигалок"
      ]
    },
    {
      "id": "psychoactive-plants",
      "name": "Психоактивные растения и грибы",
      "items": ["Мухомор"]
    }
  ]
}
