{
  "schemaVersion": 1,
  "id": "chip-flavors",
  "name": "Вкусы чипсов",
  "description": "Разные по смыслу вкусы — от знакомой классики до безумных экспериментов",
  "groups": [
    {
      "id": "familiar-classics",
      "name": "Знакомая классика",
      "items": [
        "С солью",
        "Сметана и лук",
        "Паприка",
        "Аджика",
        "Малосольный огурец с укропом",
        "Соль и уксус",
        "Картошечка с маслом и укропом",
        "Медовая горчица",
        "Ранч",
        "Чеснок",
        "Кетчуп"
      ]
    },
    {
      "id": "restaurant-and-world-cuisine",
      "name": "Ресторанные блюда и кухни мира",
      "items": [
        "Сыр чеддер с халапеньо по-мексикански",
        "Нежный сыр с трюфелем",
        "Пицца «Четыре сыра»",
        "Белые грибы со сметаной",
        "Драники",
        "Том ям",
        "Бешбармак",
        "Тако",
        "Терияки",
        "Карри масала",
        "Гуакамоле"
      ]
    },
    {
      "id": "meat-and-fast-food",
      "name": "Мясо и фастфуд",
      "items": [
        "Курица и вафли",
        "Двойной гамбургер",
        "Стейк рибай",
        "Куриные крылышки барбекю",
        "Копчёный бекон",
        "Шашлык",
        "Утка по-пекински",
        "Ростбиф с горчицей",
        "Пепперони",
        "Хот-дог с горчицей"
      ]
    },
    {
      "id": "seafood",
      "name": "Морепродукты",
      "items": [
        "Устрица с жареным чесноком",
        "Острый кальмар",
        "Пряная креветка",
        "Лангустины в томатном соусе",
        "Краб",
        "Чёрная икра",
        "Лосось в сливочном соусе",
        "Морские водоросли нори",
        "Такояки с осьминогом",
        "Гребешки в сливочном масле"
      ]
    },
    {
      "id": "spicy-and-fresh",
      "name": "Острое, кислое и свежее",
      "items": [
        "Чили и лайм",
        "Шрирача",
        "Васаби",
        "Кимчи",
        "Сычуаньский хот-пот мала",
        "Сальса верде",
        "Пери-пери",
        "Лечо",
        "Томат с базиликом",
        "Розмарин с морской солью"
      ]
    },
    {
      "id": "sweet-and-experimental",
      "name": "Сладкое и экспериментальное",
      "items": [
        "Капучино",
        "Лось в кленовом сиропе",
        "Булочка с корицей",
        "Черника",
        "Цветущая сакура",
        "Игристое",
        "Солёная карамель",
        "Шоколад",
        "Мёд и сливочное масло",
        "Банан",
        "Клубника со сливками",
        "Тыквенные пряности",
        "Кокосовое молоко",
        "Маршмеллоу",
        "Кола"
      ]
    }
  ]
}
