{
  "schemaVersion": 1,
  "id": "places",
  "name": "Места",
  "description": "Знакомые места и учреждения",
  "groups": [
    {
      "id": "transport-hubs",
      "name": "Транспортные узлы",
      "items": ["Аэропорт", "Железнодорожный вокзал", "Порт"]
    },
    {
      "id": "city-transport",
      "name": "Городской транспорт",
      "items": ["Метро", "Автобусная остановка"]
    },
    {
      "id": "education",
      "name": "Учёба",
      "items": ["Школа", "Университет", "Университет Синергия (лол)"]
    },
    {
      "id": "medicine",
      "name": "Медицина",
      "items": ["Больница", "Стоматология", "Ветеринарная клиника"]
    },
    {
      "id": "food-venues",
      "name": "Заведения",
      "items": ["Ресторан", "Столовая", "Бар", "Кофейня Джеффрис (в вышке)"]
    },
    {
      "id": "shopping",
      "name": "Покупки",
      "items": ["Супермаркет", "Рынок", "Торговый центр"]
    },
    {
      "id": "culture",
      "name": "Культура и зрелища",
      "items": ["Кинотеатр", "Театр", "Музей", "Цирк"]
    },
    {
      "id": "sports",
      "name": "Спорт",
      "items": ["Стадион", "Спортзал", "Бассейн", "Каток", "Теннисный корт"]
    },
    {
      "id": "accommodation",
      "name": "Ночлег и отдых",
      "items": ["Отель", "Санаторий"]
    },
    {
      "id": "workplaces",
      "name": "Рабочие места",
      "items": ["Офис", "Завод", "Стройка"]
    },
    {
      "id": "public-services",
      "name": "Городские службы",
      "items": ["Банк", "МФЦ"]
    },
    {
      "id": "outdoor-leisure",
      "name": "Отдых в городе",
      "items": ["Парк", "Пляж", "Зоопарк", "Парк аттракционов"]
    }
  ]
}
