{
  "schemaVersion": 1,
  "id": "berries",
  "name": "Ягоды и фрукты",
  "description": "Привычные и экзотические фрукты, вкусные и ядовитые ягоды",
  "groups": [
    {
      "id": "classic-fruits",
      "name": "Стандартные фрукты",
      "items": ["Яблоко", "Банан", "Груша", "Апельсин", "Персик"]
    },
    {
      "id": "poisonous-berries-and-fruits",
      "name": "Ядовитые ягоды и плоды",
      "items": ["Ландыш", "Волчья ягода", "Вороний глаз", "Белладонна", "Дурман"]
    },
    {
      "id": "tasty-berries",
      "name": "Вкусные ягоды",
      "items": ["Клубника", "Малина", "Ежевика", "Черника", "Черешня"]
    },
    {
      "id": "russian-berries",
      "name": "Русские ягоды",
      "items": ["Смородина", "Клюква", "Брусника", "Морошка", "Облепиха"]
    },
    {
      "id": "exotic-fruits",
      "name": "Экзотические фрукты",
      "items": ["Драгонфрут", "Старфрут", "Манго", "Маракуйя", "Личи"]
    },
    {
      "id": "juicy-fruits",
      "name": "Сочные плоды",
      "items": ["Виноград", "Дыня", "Арбуз", "Гранат", "Киви"]
    }
  ]
}
